Company Name,Website
Z-CAR RENTAL & TRAVEL SERVICE PTE LTD,
ZTP GINSENG BIRDNEST PTE LTD,
ZIRCON ENGINEERING PTE LTD,
ZINGAPORE GRILL PTE LTD,
ZUGO PHOTONICS PTE LTD,
ZF ASIA PACIFIC PTE LTD,
ZENITH LABEL PRINTING COMPANY,
ZAGRO ASIA LIMITED,
ZEPHYR CO (PTE) LTD,
ZICOM HOLDINGS PTE LTD,
ZAC N LIMOUSINE SERVICES,www.zaclimousine.com
ZEN VOCE MANUFACTURING PTE LTD,
ZINGMOBILE PTE LTD,
ZENITH ENGRG PTE LTD,
ZENACO CO2 (S) PTE LTD,
ZUJI TRAVEL PTE LTD,
ZHONGGUO POWERPLUS INDUSTRIES LTD,
ZMC TECHNOLOGIES PTE LTD,
ZINGRILL HOLDINGS PTE LTD,
ZOOM ENGINEERING PTE LTD,www.zoomengrg.com.sg
ZENDER-FANG ASSOCIATES PTE LTD,
ZUELLIG PHARMA PTE LTD,
ZAC MEAT & POULTRY PTE LTD,
ZEN VOCE HOLDINGS PTE LTD,
ZEPHYR SILKSCREEN CO. (PTE) LTD,
ZHAN CHANG HOLDINGS PTE LTD,www.zhanchang.com.sg
ZHENG KENG ENGINEERING & CONSTRUCTION PTE LTD,
ZAP PILING PTE LTD,
ZEUS LABEL & SILKSCREEN CO,
ZACCO CLEANING & MAINTENANCE SERVICES PTE LTD,
ZEBEC CO PTE LTD,
ZEE 2 ZEE CORPORATE SERVICES PTE LTD,
ZEON ASIA PTE LTD,
ZINGDO RESTAURANT,
Z KURODA (SINGAPORE) PTE LTD,
ZOOM TECH PTE LTD,www.zoomtech.com.sg
